{
  "schema": "urn:ai-friends:schema:agent:v1:tool-request",
  "request_id": "d08e9da2-b120-43f3-a475-8091021324ab",
  "trace_id": "b2c3d4e5f6071829b2c3d4e5f6071829",
  "issued_at": "2026-08-30T10:05:00Z",
  "deadline": "2026-08-30T10:05:30Z",
  "tool": "file.read",
  "tool_version": 1,
  "descriptor_hash": "sha256:c3d4e5f607182930c3d4e5f607182930c3d4e5f607182930c3d4e5f607182930",
  "args": {
    "path": {
      "kind": "path",
      "root_id": "reports",
      "relpath": "2026/q3/summary.md"
    }
  },
  "args_hash": "sha256:e5f60718293a4b5ce5f60718293a4b5ce5f60718293a4b5ce5f60718293a4b5c",
  "canon": "afcanon/1",
  "attempt": 1,
  "actor": {
    "kind": "agent",
    "id": "agent:runner-7f3a"
  },
  "act": [
    {
      "kind": "agent",
      "id": "agent:runner-7f3a"
    },
    {
      "kind": "human",
      "id": "human:op-a1b2"
    }
  ],
  "session_id": "sess-9f2b",
  "target": {
    "kind": "path",
    "root_id": "reports",
    "relpath": "2026/q3/summary.md"
  },
  "capabilities": [
    {
      "capability_id": "cap:read-reports-2026q3",
      "action": "file.read"
    }
  ],
  "provenance": {
    "lowest": "operator",
    "derived_from_untrusted": false,
    "attestation": {
      "attested_by": {
        "kind": "service",
        "id": "service:af-orchestrator"
      },
      "attested_at": "2026-08-30T10:05:00Z",
      "signature": {
        "alg": "Ed25519",
        "key_id": "orchestrator-provenance-2026q3",
        "value": "c2FtcGxlLXNpZ25hdHVyZS1ub3QtYS1yZWFsLWtleS1vcmNoZXN0cmF0b3ItLS0tLS0tLS0tLS0tLS0tLS0tLQ"
      }
    }
  }
}
